Sheet: Tabelle1
A1: Value 1 | B1: Value 2 | C1: Product | E1: Iteration
A3: 1.2344999999999999 | B3: 2.3456000000000001 | C3: =RC[-2]*RC[-1] -> 2.8956431999999999 | D3: =IF(RC[1]=0, 0.001, RC[1]) -> 3.1492870647592785E+230 | E3: =(0.8+RC[-1])*RC[-2] -> 9.1192116739181637E+230
A4: =IF(R[-2]C>1.1, 1.1, 2.2*R[-1]C[1]) -> 5.1603200000000005
D5: =IF(RC[1]=0, 0.1, RC[1]) -> 2.1999999999999997 | E5: =2.3-RC[-1] -> 0.10000000000000009